"name","authors","year","base","booktitle","doi"
"Use of ontology structure and Bayesian models to aid the crowdsourcing of ICD-11 sanctioning rules","Lou, Yun and Tu, Samson W. and Nyulas, Csongor and Tudorache, Tania and Chalmers, Robert J.G. and Musen, Mark A.",2017,"[""Science Direct"",""Engineering Village""]",,
"MySQL extension automatic porting to PDO for PHP migration and security improvement","Mondin, Fabio and Cortesi, Agostino",2018,"[""Engineering Village""]",,
"Exact Reconstruction from Insertions in Synchronization Codes","Sala, Frederic and Gabrys, Ryan and Schoeny, Clayton and Dolecek, Lara",2017,"[""IEEE"",""Engineering Village""]",,
"Segregating feature interfaces to support software product line maintenance","Cafeo, Bruno B.P. and Hunsen, Claus and Garcia, Alessandro and Apel, Sven and Lee, Jaejoon",2016,"[""ACM"",""Engineering Village""]",,
"RCLinker: Automated Linking of Issue Reports and Commits Leveraging Rich Contextual Information","Le, Tien-Duy B. and Linares-Vasquez, Mario and Lo, David and Poshyvanyk, Denys",2015,"[""IEEE"",""Engineering Village""]",,
"A quality driven extension to the QVT-relations transformationlanguage","Drago, Mauro Luigi and Ghezzi, Carlo and Mirandola, Raffaela",2015,"[""Engineering Village""]",,
"Detecting and predicting evolution in spreadsheets-a case study in an energy network company","Jansen, Bas and Hermans, Felienne and Tazelaar, Edwin",2018,"[""Engineering Village""]",,
"Parallel implementation of a combined moment expansion and spherical-multipole time-domain near-field to far-field transformation","Ramos, Glaucio L. and Rego, Cassio G. and Fonseca, Alexandre R.",2014,"[""IEEE"",""Engineering Village""]",,
"Demo: Interactive robot transition repair","Holtz, Jarrett and Guha, Arjun and Biswas, Joydeep",2018,"[""Engineering Village""]",,
"Process mining multiple repositories for software defect resolution from control and organizational perspective","Gupta, Monika and Sureka, Ashish and Padmanabhuni, Srinivas",2014,"[""ACM"",""Engineering Village""]",,
"Synthesizing VHDL from activity models in UML 2","Balderas-Contreras, Tomas and Cumplido, Rene and Rodriguez, Gustavo",2014,"[""Engineering Village""]",,
"Programming arduino boards with the C/C++ interpreter CH","Turley, Curtis and Alessandra Montironi, Maria",2015,"[""Engineering Village""]",,
"Symbolic crosschecking of data-parallel floating-point code","Collingbourne, Peter and Cadar, Cristian and Kelly, Paul H.J.",2014,"[""IEEE"",""Engineering Village""]",,
"Investigating static analysis errors in student Java programs","Edwards, Stephen H. and Kandru, Nischel and Rajagopal, Mukund B.M.",2017,"[""ACM"",""Engineering Village""]",,
"Improved query reformulation for concept location using CodeRank and document structures","Rahman, Mohammad Masudur and Roy, Chanchal K.",2017,"[""IEEE"",""Engineering Village""]",,
"Towards suitable research paradigm for assessing the impact of free and open source software (foss)","Dehinbo, Kehinde O. and Dehinbo, Johnson O.",2013,"[""Engineering Village""]",,
"If memory serves: Towards designing and evaluating a game for teaching pointers to undergraduate students","McGill, Monica M. and Johnson, Chris and Atlas, James and Bouchard, Durell and Messom, Chris and Pollock, Ian and Scott, Michael James",2018,"[""ACM"",""Engineering Village""]",,
"Where's my code? Engineers navigating ethical issues on an uneven terrain","Rottmann, Cindy and Reeve, Doug and Sacks, Robin and Klassen, Mike",2018,"[""Engineering Village""]",,
"Droidsentry: Efficient Code Integrity and Control Flow Verification on TrustZone Devices","Suciu, Darius-Andrei and Sion, Radu",2017,"[""IEEE"",""Engineering Village""]",,
"Design Space Exploration based on multiobjective genetic algorithms and clustering-based high-level estimation","Martins, Luiz G. A. and Marques, Eduardo",2013,"[""Engineering Village""]",,
"Using topic models to support software maintenance","Grant, Scott and Cordy, James R. and Skillicorn, David B.",2012,"[""IEEE"",""Engineering Village""]",,
"What if i Had No Smells?","Falessi, Davide and Russo, Barbara and Mullen, Kathleen",2017,"[""IEEE"",""ACM"",""Engineering Village""]",,
"Self-modification of policy and utility function in rational agents","Everitt, Tom and Filan, Daniel and Daswani, Mayank and Hutter, Marcus",2016,"[""Engineering Village""]",,
"Efficient dynamic malware analysis based on network behavior using deep learning","Shibahara, Toshiki and Yagi, Takeshi and Akiyama, Mitsuaki and Chiba, Daiki and Yada, Takeshi",2016,"[""IEEE"",""Engineering Village""]",,
"From problem landscapes to language landscapes: Questions in genetic improvement","Cody-Kenny, Brendan and Fenton, Michael and O'Neill, Michael",2017,"[""ACM"",""Engineering Village""]",,
"Learning convolutional action primitives for fine-grained action recognition","Lea, Colin and Vidal, Rene and Hager, Gregory D.",2016,"[""IEEE"",""Engineering Village""]",,
"Neural Conditional Energy Models for Multi-label Classification","Jing, How and Lin, Shou-De",2015,"[""IEEE"",""Engineering Village""]",,
"Customizable Computing-- From Single Chip to Datacenters","Cong, Jason and Fang, Zhenman and Huang, Muhuan and Wei, Peng and Wu, Di and Yu, Cody Hao",2018,"[""Engineering Village""]",,
"The MESSAGEix Integrated Assessment Model and the ix modeling platform (ixmp): An open framework for integrated and cross-cutting analysis of energy, climate, the environment, and sustainable development","Huppmann, Daniel and Gidden, Matthew and Fricko, Oliver and Kolp, Peter and Orthofer, Clara and Pimmer, Michael and Kushin, Nikolay and Vinca, Adriano and Mastrucci, Alessio and Riahi, Keywan and Krey, Volker",2019,"[""Science Direct"",""Engineering Village""]",,
"How do developers resolve merge conflicts? An investigation into the processes, tools, and improvements","Brindescu, Caius",2018,"[""ACM"",""Engineering Village""]",,
"Numerical simulation of single bubble condensation in subcooled flow using OpenFOAM","Zeng, Qingyun and Cai, Jiejin and Yin, Huaqiang and Yang, Xingtuan and Watanabe, Tadashi",2015,"[""Science Direct"",""Engineering Village""]",,
"A case study of the effects of architecture debt on software evolution effort","Snipes, Will and Karlekar, Sunil L. and Mo, Ran",2018,"[""IEEE"",""Engineering Village""]",,
"Switching to Git: The Good, the Bad, and the Ugly","Just, Sascha and Herzig, Kim and Czerwonka, Jacek and Murphy, Brendan",2016,"[""IEEE"",""Engineering Village""]",,
"Model based rapid prototyping and evolution of web application","Falzone, Emanuele and Bernaschina, Carlo",2018,"[""Engineering Village""]",,
"Satisfying rival forestry objectives in the komi republic: Effects of russian zoning policy change on wood production and riparian forest conservation","Naumov, Vladimir and Angelstam, Per and Elbakidze, Marine",2017,"[""Engineering Village""]",,
"An implementation of just-in-time fault-prone prediction technique using text classifier","Mori, Keita and Mizuno, Osamu",2015,"[""IEEE"",""Engineering Village""]",,
"Proposition of a three layers architecture for adaptable artificial intelligence","Benoit, Vallade and Alexandre, David and Nakashima, Tomoharu",2014,"[""Engineering Village""]",,
"An automation framework for configuration management to reduce manual intervention","Karale, Supriya V. and Kaushal, Vishal",2016,"[""ACM"",""Engineering Village""]",,
"GreenScaler: training software energy models with automatic test generation","Chowdhury, Shaiful and Borle, Stephanie and Romansky, Stephen and Hindle, Abram",2018,"[""Engineering Village""]",,
"Automatic performance testing using input-sensitive profiling","Luo, Qi",2016,"[""ACM"",""Engineering Village""]",,
"Towards a framework for stochastic performance optimizations in compilers and interpreters - An architecture overview","Krauss, Oliver",2018,"[""Engineering Village""]",,
"Foreground segmentation using convolutional neural networks for multiscale feature encoding","Lim, Long Ang and Yalim Keles, Hacer",2018,"[""Engineering Village""]",,
"A new analytical solution for assessing climate change impacts on subsurface temperature","Kurylyk, Barret L. and Macquarrie, Kerry T.B.",2014,"[""Engineering Village""]",,
"An evolutionary framework for cultural change: Selectionism versus communal exchange","Gabora, Liane",2013,"[""Engineering Village""]",,
"Optimization and parallelization of the thermal-hydraulic subchannel code Cobra-En using parallel infrastructure jasmin","Li, Kang and Liu, Na and Liu, Peng and Shi, Dunfu and Tian, Baolin",2017,"[""Engineering Village""]",,
"The unified integral transforms (Unit) algorithm with total and partial transformation","Cotta, Renato M. and Knupp, Diego C. and Naveira-Cotta, Carolina P. and Sphaier, Leandro A. and Quaresma, Joaon",2014,"[""Engineering Village""]",,
"PRISM revisited: Declarative implementation of a probabilistic programming language using multi-prompt delimited control","Abdallah, Samer",2018,"[""Science Direct"",""Engineering Village""]",,
"Development of a discrete adjoint CFD code using algorithmic differentiation by operator overloading","Dastouri, Z. and Lotz, J. and Naumann, U.",2014,"[""Engineering Village""]",,
"Parallelization of digital wavelet transformation of ECG signals","Domazet, Ervin and Gusev, Marjan",2017,"[""IEEE"",""Engineering Village""]",,
"How much really changes? A case study of firefox version evolution using a clone detector","Lavoie, Thierry and Merlo, Ettore",2013,"[""IEEE"",""Engineering Village""]",,
"Mobile multi-agent systems for the internet-of-things and clouds using the javascript agent machine platform and machine learning as a service","Bosse, Stefan",2016,"[""IEEE"",""Engineering Village""]",,
"Code-changeable encoded microparticles for multi-step bead-based assay","Kwon, Taehong and Song, Younghoon and Lee, Daewon and Kim, Mira and Park, Tae-Joon and Kwon, Sunghoon",2012,"[""Engineering Village""]",,
"Versioning for end-to-end machine learning pipelines","Van Der Weide, Tom and Papadopoulos, Dimitris and Smirnov, Oleg and Zielinski, Michal and Van Kasteren, Tim",2017,"[""ACM"",""Engineering Village""]",,
"Code review analytics: Webkit as case study","Gonzalez-Barahona, Jesus M. and Izquierdo-Cortazar, Daniel and Robles, Gregorio and Gallegos, Mario",2014,"[""Engineering Village""]",,
"Supporting code review by automatic detection of potentially buggy changes","Fejzer, Mikolaj and Wojtyna, Michal and Burzaska, Marta and Winiewski, Piotr and Stencel, Krzysztof",2015,"[""Engineering Village""]",,
"Supporting code review by automatic detection of potentially buggy changes","Fejzer, Mikolaj and Wojtyna, Michal and Burzaska, Marta and Winiewski, Piotr and Stencel, Krzysztof",2015,"[""Engineering Village""]",,
"Learning looping: From natural language to worked examples","Sudol-DeLyser, Leigh Ann and Stehlik, Mark and Carver, Sharon",2012,"[""Engineering Village""]",,
"Experience with digital game-based embodied learning: The road to create a framework for physically interactive digital games","Busch, Carsten and Conrad, Florian and Meyer, Robert and Steinicke, Martin",2013,"[""Engineering Village""]",,
"Code analyser in CSTutor - A C# Intelligent Tutoring System","Hartanto, Budi and Reye, Jim",2013,"[""Engineering Village""]",,
"Active convolution: Learning the shape of convolution for image classification","Jeon, Yunho and Kim, Junmo",2017,"[""IEEE"",""Engineering Village""]",,
"CUDA multiclass change detection for remote sensing hyperspectral images using extended morphological profiles","Lopez-Fandino, Javier and Heras, Dora B. and Arguello, Francisco and Duro, Richard J.",2017,"[""IEEE"",""Engineering Village""]",,
"Predicting change consistency in a clone group","Zhang, Fanlong and Khoo, Siau-cheng and Su, Xiaohong",2017,"[""Engineering Village""]",,
"Multi up-gradation software reliability growth model with learning effect and severity of faults using SDE","Singh, Jagvinder and Singh, Ompal and Kapur, P.K.",2015,"[""Engineering Village""]",,
"Predicting Consistent Clone Change","Zhang, Fanlong and Khoo, Siau-Cheng and Su, Xiaohong",2016,"[""Engineering Village""]",,
"Formal description and verification of a text-based model differencing and merging method","Somogyi, Ferenc A. and Asztalos, Mark",2018,"[""Engineering Village""]",,
"Using graph-based program characterization for predictive modeling","Park, Eunjung and Cavazos, John and Alvarez, Marco A.",2012,"[""ACM"",""Engineering Village""]",,
"Minnesota sustainable building guidelines: History, effectiveness and path for the future","Graves, Richard and Smith, Patrick",2018,"[""Engineering Village""]",,
"Helping mobile software code reviewers: A study of bug repair and refactoring patterns","Chen, Zhiyuan",2016,"[""IEEE"",""ACM"",""Engineering Village""]",,
"Multi-layered approach for recovering links between bug reports and fixes","Nguyen, Anh Tuan and Nguyen, Tung Thanh and Nguyen, Hoan Anh and Nguyen, Tien N.",2012,"[""ACM"",""Engineering Village""]",,
"Axially deformed solution of the SkyrmeHartreeFockBogolyubov equations using the transformed harmonic oscillator basis (III) HFBTHO (v3.00): A new version of the program","Perez, R. Navarro and Schunck, N. and Lasseri, R.-D. and Zhang, C. and Sarich, J.",2017,"[""Engineering Village""]",,
"POINCARE CODE: A package of open-source implements for normalization and computer algebra reduction near equilibria of coupled ordinary differential equations","Mikram, J. and Zinoun, F. and El Abdllaoui, A.",2013,"[""Engineering Village""]",,
"Data hiding based on overlapped pixels using hamming code","Kim, Cheonshik and Yang, Ching-Nung",2016,"[""Engineering Village""]",,
"Industrial experience with the migration of legacy models using a DSL","Schuts, Mathijs and Hooman, Jozef and Tielemans, Paul",2018,"[""ACM"",""Engineering Village""]",,
"Visualizing Time-based Weighted Coupling Using Particle Swarm Optimization to Aid Program Comprehension","Hendrawan, Rully Agus and Maruyama, Katsuhisa",2015,"[""Science Direct"",""Engineering Village""]",,
"Heuristic expansion of feature mappings in evolving program families","Nunes, Camila and Garcia, Alessandro and Lucena, Carlos and Lee, Jaejoon",2014,"[""Engineering Village""]",,
"Code Reviewing in the Trenches: Challenges and Best Practices","MacLeod, Laura and Greiler, Michaela and Storey, Margaret-Anne and Bird, Christian and Czerwonka, Jacek",2018,"[""IEEE"",""Engineering Village""]",,
"Electron number distribution functions from molecular wavefunctions. Version 2","Francisco, E. and Martin Pendas, A.",2014,"[""Science Direct"",""Engineering Village""]",,
"A new measure of code complexity during software evolution: 'A case study'","Singh, Vinay and Bhattacherjee, Vandana",2014,"[""Engineering Village""]",,
"Learning better inspection optimization policies","Lumpe, Markus and Vasa, Rajesh and Menzies, Tim and Rush, Rebecca and Turhan, Burak",2012,"[""Engineering Village""]",,
"Model Change Detection With the MDL Principle","Yamanishi, Kenji and Fukushima, Shintaro",2018,"[""IEEE"",""Engineering Village""]",,
"Framework support for the efficient implementation of multi-version algorithms","Dias, Ricardo J. and Vale, Tiago M. and Lourenco, Joao M.",2015,"[""Engineering Village""]",,
"SSPARED: Saliency and sparse code analysis for rare event detection in video","Sarkar, Rituparna and Vaccari, Andrea and Acton, Scott T.",2016,"[""IEEE"",""Engineering Village""]",,
"Pseudo labels for imbalanced multi-label learning","Zeng, Wenrong and Chen, Xuewen and Cheng, Hong",2014,"[""IEEE"",""Engineering Village""]",,
"Apollo: Reusable Models for Fast, Dynamic Tuning of Input-Dependent Code","Beckingsale, David and Pearce, Olga and Laguna, Ignacio and Gamblin, Todd",2017,"[""IEEE"",""Engineering Village""]",,
"Rock physics modeling for waterflood simulation: A case history from the burgan field, Kuwait","Edwards, K. and Ebrahim, M. and Qassim, F. and Al-Asfour, S.",2015,"[""Engineering Village""]",,
"Introduction to SWAT+, A Completely Restructured Version of the Soil and Water Assessment Tool","Bieger, Katrin and Arnold, Jeffrey G. and Rathjens, Hendrik and White, Michael J. and Bosch, David D. and Allen, Peter M. and Volk, Martin and Srinivasan, Raghavan",2017,"[""Engineering Village""]",,
"Verification and validation of EnergyPlus phase change material model for opaque wall assemblies","Tabares-Velasco, Paulo Cesar and Christensen, Craig and Bianchi, Marcus",2012,"[""Engineering Village""]",,
"An ensemble-rich multi-aspect approach for robust style change detection: Notebook for PAN at CLEF-2018","Zlatkova, Dimitrina and Kopev, Daniel and Mitov, Kristiyan and Atanasov, Atanas and Hardalov, Momchil and Koychev, Ivan and Nakov, Preslav",2018,"[""Engineering Village""]",,
"Face detection method based on histogram of sparse code in tree deformable model","Zhang, Qi and Zhou, Li-Fang and Li, Wei-Sheng and Ricanek, Karl and Li, Xin-Yi",2017,"[""IEEE"",""Engineering Village""]",,
"How the evolution of emerging collaborations relates to code changes: An empirical study","Panichella, Sebastiano and Canfora, Gerardo and Di Penta, Massimiliano and Oliveto, Rocco",2014,"[""ACM"",""Engineering Village""]",,
"A brief history of parameterized matching problems","Mendivelso, Juan and Thankachan, Sharma V. and Pinzon, Yoan",2018,"[""Science Direct"",""Engineering Village""]",,
"Do developers update third-party libraries in mobile apps?","Salza, Pasquale and Palomba, Fabio and Di Nucci, Dario and D'Uva, Cosmo and De Lucia, Andrea and Ferrucci, Filomena",2018,"[""ACM"",""Engineering Village""]",,
"Extracting artifact lifecycle models from metadata history","Baysal, Olga and Kononenko, Oleksii and Holmes, Reid and Godfrey, Michael W.",2013,"[""IEEE"",""Engineering Village""]",,
"Displaying people with old addresses on a map","Zhang, Gang and Murakami, Harumi",2015,"[""Engineering Village""]",,
"Collective personalized change classification with multiobjective search","Xia, Xin and Lo, David and Wang, Xinyu and Yang, Xiaohu",2016,"[""IEEE"",""Engineering Village""]",,
"Experimental characterisation of sub-cooling in hydrated salt phase change materials","Taylor, Robert A. and Tsafnat, Naomi and Washer, Alex",2016,"[""Engineering Village""]",,
"Mining API expertise profiles with Partial Program Analysis","Mani, Senthil and Padhye, Rohan and Sinha, Vibha Singhal",2016,"[""ACM"",""Engineering Village""]",,
"Spatio-temporal analysis of GPS tracks of CODE RED: MOBILE an experimental mobile scenario and location based training exercise","Quinn, P.B. and Cartwright, W.E.",2012,"[""Engineering Village""]",,
"Round-Robin Test of Paraffin Phase-Change Material","Vidi, S. and Mehling, H. and Hemberger, F. and Haussmann, Th. and Laube, A.",2015,"[""Engineering Village""]",,
"A slice-based estimation approach for maintenance effort","Alomari, Hakam W. and Collard, Michael L. and Maletic, Jonathan I.",2014,"[""IEEE"",""Engineering Village""]",,
"Developer recommendation with awareness of accuracy and cost","Liu, Jin and Tian, Yiqiuzi and Hong, Liang and Xu, Zhou",2016,"[""Engineering Village""]",,
"Development of mobile serious game for self-assessment as base for a game-editor for teachers","Herrler, Andreas and Grubert, Simon and Kajzer, Marko and Behrens, Sadie and Klamma, Ralf",2016,"[""Engineering Village""]",,
"An ensemble SVM model for the accurate prediction of non-canonical MicroRNA targets","Ghoshal, Asish and Grama, Ananth and Bagchi, Saurabh and Chaterji, Somali",2015,"[""ACM"",""Engineering Village""]",,
"Visualizations of evolving graphical models in the context of model review","Zoubek, Florian and Langer, Philip and Mayerhofer, Tanja",2018,"[""ACM"",""Engineering Village""]",,
"Answering software evolution questions: An empirical evaluation","Hattori, Lile and D'Ambros, Marco and Lanza, Michele and Lungu, Mircea",2013,"[""Science Direct"",""Engineering Village""]",,
"Evolution of XSD documents and their variability during project life cycle: A preliminary study","De Almeida, Diego Benincasa Fernandes Cavalcanti and Guerra, Eduardo Martins",2016,"[""Engineering Village""]",,
"The road code: encouraging more efficient driving practices in New Zealand","Scott, Michelle Grace and Lawson, Rob",2018,"[""Engineering Village""]",,
"A Clairvoyant Approach to Evaluating Software (In)Security","Jain, Bhushan and Tsai, Chia-Che and Porter, Donald E.",2017,"[""ACM"",""Engineering Village""]",,
"Extracting dependencies from software changes: An industry experience report","Wetzlmaier, Thomas and Klammer, Claus and Ramler, Rudolf",2014,"[""IEEE"",""Engineering Village""]",,
"Active files as a measure of software maintainability","Schulte, Lukas and Sajnani, Hitesh and Czerwonka, Jacek",2014,"[""ACM"",""Engineering Village""]",,
"Using LSTMs to model the java programming language","Boldt, Brendon",2017,"[""Engineering Village""]",,
"Coarse grain parallelization of deep neural networks","Tallada, Marc Gonzalez",2016,"[""ACM"",""Engineering Village""]",,
"Designing linear algebra algorithms by transformation: Mechanizing the expert developer","Marker, Bryan and Poulson, Jack and Batory, Don and Van De Geijn, Robert",2013,"[""Engineering Village""]",,
"Gabor Convolutional Networks","Luan, Shangzhen and Zhang, Baochang and Zhou, Siyue and Chen, Chen and Han, Jungong and Yang, Wankou and Liu, Jianzhuang",2018,"[""Engineering Village""]",,
"An efficient approach for providing rationale of method change for object oriented programming","Ami, Amit Seal and Islam, Md. Shariful",2014,"[""IEEE"",""Engineering Village""]",,
"Gabor Convolutional Networks","Luan, Shangzhen and Chen, Chen and Zhang, Baochang and Han, Jungong and Liu, Jianzhuang",2018,"[""Engineering Village""]",,
"Bypassing system callsbased intrusion detection systems","Rosenberg, Ishai and Gudes, Ehud",2017,"[""Engineering Village""]",,
"Evading system-calls based intrusion detection systems","Rosenberg, Ishai and Gudes, Ehud",2016,"[""Engineering Village""]",,
"Attacking and defending dynamic analysis system-calls based IDS","Rosenberg, Ishai and Gudes, Ehud",2016,"[""Engineering Village""]",,
"Measuring software library stability through historical version analysis","Raemaekers, Steven and Van Deursen, Arie and Visser, Joost",2012,"[""IEEE"",""Engineering Village""]",,
"An aggregated coupling measure for the analysis of object-oriented software systems","Czibula, Istvan Gergely and Czibula, Gabriela and Miholca, Diana-Lucia and Onet-Marian, Zsuzsanna",2019,"[""Science Direct"",""Engineering Village""]",,
"Learning syntactic program transformations from examples","Rolim, Reudismam and Soares, Gustavo and D'Antoni, Loris and Polozov, Oleksandr and Gulwani, Sumit and Gheyi, Rohit and Suzuki, Ryo and Hartmann, Bjorn",2017,"[""IEEE"",""ACM"",""Engineering Village""]",,
"Automation of Upgrade Process for Enterprise Resource Planning Systems","Laukaitis, Algirdas",2013,"[""Engineering Village""]",,
"Efficient code generation for automatic parallelization and optimization","Bastoul, Cedric",2015,"[""Engineering Village""]",,
"Annotation-free and one-shot learning for instance segmentation of homogeneous object clusters","Wu, Zheng and Chang, Ruiheng and Ma, Jiaxu and Lu, Cewu and Tang, Chi Keung",2018,"[""Engineering Village""]",,
"Querying sequential software engineering data","Sun, Chengnian and Zhang, Haidong and Lou, Jian-Guang and Zhang, Hongyu and Wang, Qiang and Zhang, Dongmei and Khoo, Siau-Cheng",2014,"[""ACM"",""Engineering Village""]",,
"Data change analysis based on function call path","Yong, Cao and Yongmin, Mu and Meie, Shen",2018,"[""Engineering Village""]",,
"Impact of gamification on code review process - An experimental study","Khandelwal, Shivam and Sripada, Sai Krishna and Raghu Reddy, Y.",2017,"[""Engineering Village""]",,
"Information transformation and automated reasoning for automated compliance checking in construction","Zhang, J. and El-Gohary, N.M.",2013,"[""Engineering Village""]",,
"Machine learning using R","Ramasubramanian, Karthik and Singh, Abhishek",2016,"[""Engineering Village""]",,
"Deep auto-encoder based on supervised learning for damaged face reconstruction","Rui, Ting and Zhang, Sai and Zou, Junhua and Zhou, You and Tang, Jian",2018,"[""Engineering Village""]",,
"Prediction and ranking of co-change candidates for clones","Mondal, Manishankar and Roy, Chanchal K. and Schneider, Kevin A.",2014,"[""ACM"",""Engineering Village""]",,
"Detecting, Tracing, and Monitoring Architectural Tactics in Code","Mirakhorli, Mehdi and Cleland-Huang, Jane",2016,"[""IEEE"",""Engineering Village""]",,
"Deep Reinforcement Learning for Surgical Gesture Segmentation and Classification","Liu, Daochang and Jiang, Tingting",2018,"[""Engineering Village""]",,
"Surface water mapping by deep learning","Isikdogan, Furkan and Bovik, Alan C. and Passalacqua, Paola",2017,"[""IEEE"",""Engineering Village""]",,
"Towards a blended learning using mobile devices, podcasts and QR codes in Algeria","Ghizlene, Soulimane and Belkacem, Kouninef and Mohamed, Djelti",2017,"[""Engineering Village""]",,
"Experience report: Evaluating the effectiveness of decision trees for detecting code smells","Amorim, Lucas and Costa, Evandro and Antunes, Nuno and Fonseca, Baldoino and Ribeiro, Marcio",2015,"[""IEEE"",""Engineering Village""]",,
"Fatiguing STDP: Learning from spike-timing codes in the presence of rate codes","Moraitis, Timoleon and Sebastian, Abu and Boybat, Irem and Le Gallo, Manuel and Tuma, Tomas and Eleftheriou, Evangelos",2017,"[""IEEE"",""Engineering Village""]",,
"Wikipedia miner engine: A re-usable e-learning service based on a virtual MVC design pattern","Cortez, Ruth and Vazhenin, Alexander and Brine, John",2012,"[""Engineering Village""]",,
"Supervised Machine Learning to Predict Follow-Up among Adjuvant Endocrine Therapy Patients","Harrell, Morgan and Levy, Mia and Fabbri, Daniel",2017,"[""IEEE"",""Engineering Village""]",,
