"name","authors","year","base","booktitle","doi"
"An Empirical Comparison of the Development History of Cloudstack and Eucalyptus","Zerouali, Ahmed and Mens, Tom",2017,"[""ACM"",""Engineering Village""]","Proceedings of the 2017 International Conference on Smart Digital Environment","10.1145/3128128.3128146"
"Attributing Authorship of Revisioned Content","de Alfaro, Luca and Shavlovsky, Michael",2013,"[""ACM"",""Engineering Village""]","Proceedings of the 22Nd International Conference on World Wide Web","10.1145/2488388.2488419"
"An Evaluation of Policy Frameworks for Addressing Ethical Considerations in Learning Analytics","Prinsloo, Paul and Slade, Sharon",2013,"[""ACM""]","Proceedings of the Third International Conference on Learning Analytics and Knowledge","10.1145/2460296.2460344"
"DeepSim: Deep Learning Code Functional Similarity","Zhao, Gang and Huang, Jeff",2018,"[""ACM""]","Proceedings of the 2018 26th ACM Joint Meeting on European Software Engineering Conference and Symposium on the Foundations of Software Engineering","10.1145/3236024.3236068"
"Coarse Grain Parallelization of Deep Neural Networks","Tallada, Marc Gonzalez",2016,"[""ACM"",""Engineering Village""]",,"10.1145/3016078.2851158"
"Coarse Grain Parallelization of Deep Neural Networks","Tallada, Marc Gonzalez",2016,"[""ACM"",""Engineering Village""]","Proceedings of the 21st ACM SIGPLAN Symposium on Principles and Practice of Parallel Programming","10.1145/2851141.2851158"
"Learning compact hashing codes for efficient tag completion and prediction","Wang, Qifan and Ruan, Lingyun and Zhang, Zhiwei and Si, Luo",2013,"[""ACM""]","Proceedings of the 22nd ACM international conference on Conference on information \&\#38; knowledge management","10.1145/2505515.2505649"
"Learning Compact Hashing Codes for Efficient Tag Completion and Prediction","Wang, Qifan and Ruan, Lingyun and Zhang, Zhiwei and Si, Luo",2013,"[""ACM""]","Proceedings of the 22Nd ACM International Conference on Information \& Knowledge Management","10.1145/2505515.2505649"
"A High-level Framework for Parallelizing Legacy Applications for Multiple Platforms","Arora, Ritu and Capetillo, Ejenio and Bangalore, Purushotham and Mernik, Marjan",2013,"[""ACM""]","Proceedings of the Conference on Extreme Science and Engineering Discovery Environment: Gateway to Discovery","10.1145/2484762.2484829"
"Regression Test Selection for Android Applications","Do, Quan and Yang, Guowei and Che, Meiru and Hui, Darren and Ridgeway, Jefferson",2016,"[""IEEE"",""ACM"",""Engineering Village""]","Proceedings of the International Conference on Mobile Software Engineering and Systems","10.1145/2897073.2897127"
"Project Centralization Based on Graph Coloring","Ma, Lei and Artho, Cyrille and Sato, Hiroyuki",2014,"[""ACM""]","Proceedings of the 29th Annual ACM Symposium on Applied Computing","10.1145/2554850.2554930"
"Safely Managing Data Variety in Big Data Software Development","Cerqueus, Thomas and de Almeida, Eduardo Cunha and Scherzinger, Stefanie",2015,"[""ACM""]","Proceedings of the First International Workshop on BIG Data Software Engineering",
"Learning Agile Software Engineering Practices Using Coding Dojo","Heinonen, Kenny and Hirvikoski, Kasper and Luukkainen, Matti and Vihavainen, Arto",2013,"[""ACM""]","Proceedings of the 14th Annual ACM SIGITE Conference on Information Technology Education","10.1145/2512276.2512306"
"A Learning Algorithm for Change Impact Prediction","Musco, Vincenzo and Carette, Antonin and Monperrus, Martin and Preux, Philippe",2016,"[""IEEE"",""ACM"",""Engineering Village""]","Proceedings of the 5th International Workshop on Realizing Artificial Intelligence Synergies in Software Engineering","10.1145/2896995.2896996"
"Refining Interprocedural Change-impact Analysis Using Equivalence Relations","Gyori, Alex and Lahiri, Shuvendu K. and Partush, Nimrod",2017,"[""ACM""]","Proceedings of the 26th ACM SIGSOFT International Symposium on Software Testing and Analysis","10.1145/3092703.3092719"
"The Learning Curves in Open-Source Software (OSS) Development Network","Kim, Youngsoo and Jiang, Lingxiao",2014,"[""ACM"",""Engineering Village""]","Proceedings of the Sixteenth International Conference on Electronic Commerce","10.1145/2617848.2617857"
"Dynamically Adaptive Parsons Problems","Ericson, Barbara J.",2016,"[""ACM"",""Engineering Village""]","Proceedings of the 2016 ACM Conference on International Computing Education Research","10.1145/2960310.2960342"
"Ariadne: Analysis for Machine Learning Programs","Dolby, Julian and Shinnar, Avraham and Allain, Allison and Reinen, Jenna",2018,"[""ACM""]","Proceedings of the 2Nd ACM SIGPLAN International Workshop on Machine Learning and Programming Languages","10.1145/3211346.3211349"
"How to Study Programming on Mobile Touch Devices: Interactive Python Code Exercises","Ihantola, Petri and Helminen, Juha and Karavirta, Ville",2013,"[""ACM""]","Proceedings of the 13th Koli Calling International Conference on Computing Education Research","10.1145/2526968.2526974"
"Iridescent: A Tool for Rapid Semantic Annotation of Web Service Descriptions","Stavropoulos, Thanos G. and Vrakas, Dimitris and Vlahavas, Ioannis",2013,"[""ACM""]","Proceedings of the 3rd International Conference on Web Intelligence, Mining and Semantics","10.1145/2479787.2479797"
"Recommending Relevant Code Artifacts for Change Requests Using Multiple Predictors","Denninger, Oliver",2012,"[""IEEE"",""ACM"",""Engineering Village""]","Proceedings of the Third International Workshop on Recommendation Systems for Software Engineering",
"Multi-layered Approach for Recovering Links Between Bug Reports and Fixes","Nguyen, Anh Tuan and Nguyen, Tung Thanh and Nguyen, Hoan Anh and Nguyen, Tien N.",2012,"[""ACM"",""Engineering Village""]","Proceedings of the ACM SIGSOFT 20th International Symposium on the Foundations of Software Engineering","10.1145/2393596.2393671"
"Techniques for Testing Scientific Programs Without an Oracle","Kanewala, Upulee and Bieman, James M.",2013,"[""ACM""]","Proceedings of the 5th International Workshop on Software Engineering for Computational Science and Engineering",
"Does Refactoring Improve Software Structural Quality? A Longitudinal Study of 25 Projects","Cedrim, Diego and Sousa, Leonardo and Garcia, Alessandro and Gheyi, Rohit",2016,"[""ACM""]","Proceedings of the 30th Brazilian Symposium on Software Engineering","10.1145/2973839.2973848"
"Software Change Contracts","Yi, Jooyong and Qi, Dawei and Tan, Shin Hwei and Roychoudhury, Abhik",2015,"[""ACM""]",,"10.1145/2729973"
"Helping Mobile Software Code Reviewers: A Study of Bug Repair and Refactoring Patterns","Chen, Zhiyuan",2016,"[""IEEE"",""ACM"",""Engineering Village""]","Proceedings of the International Conference on Mobile Software Engineering and Systems","10.1145/2897073.2897130"
"How Developers Document Pull Requests with External References","Zampetti, Fiorella and Ponzanelli, Luca and Bavota, Gabriele and Mocci, Andrea and Di Penta, Massimiliano and Lanza, Michele",2017,"[""ACM""]","Proceedings of the 25th International Conference on Program Comprehension","10.1109/ICPC.2017.30"
"If Memory Serves: Towards Designing and Evaluating a Game for Teaching Pointers to Undergraduate Students","McGill, Monica M. and Johnson, Chris and Atlas, James and Bouchard, Durell and Messom, Chris and Pollock, Ian and Scott, Michael James",2017,"[""ACM"",""Engineering Village""]","Proceedings of the 2017 ITiCSE Conference on Working Group Reports","10.1145/3174781.3174783"
"Active Files As a Measure of Software Maintainability","Schulte, Lukas and Sajnani, Hitesh and Czerwonka, Jacek",2014,"[""ACM"",""Engineering Village""]","Companion Proceedings of the 36th International Conference on Software Engineering","10.1145/2591062.2591176"
"New Technology, New Learning?","Rogers, Yvonne",2014,"[""ACM""]","Proceedings of the 2014 Conference on Innovation \&\#38; Technology in Computer Science Education","10.1145/2591708.2602688"
"Study of the Paired Change Points in Bacterial Genes","Suvorova, Yulia M. and Korotkova, Maria A. and Korotkov, Eugene V.",2014,"[""ACM""]",,"10.1109/TCBB.2014.2321154"
"A Transactional Memory with Automatic Performance Tuning","Wang, Qingping and Kulkarni, Sameer and Cavazos, John and Spear, Michael",2012,"[""ACM""]",,"10.1145/2086696.2086733"
"Impact of Feature Selection Techniques on Bug Prediction Models","Muthukumaran, K. and Rallapalli, Akhila and Murthy, N. L. Bhanu",2015,"[""ACM""]","Proceedings of the 8th India Software Engineering Conference","10.1145/2723742.2723754"
"BDCI: Behavioral Driven Conflict Identification","Pastore, Fabrizio and Mariani, Leonardo and Micucci, Daniela",2017,"[""ACM""]","Proceedings of the 2017 11th Joint Meeting on Foundations of Software Engineering","10.1145/3106237.3106296"
"Text Steganography in Font Color of MS Excel Sheet","Alsaadi, Husam Ibrahiem and Al-Anni, Maad Kamal and Almuttairi, Rafah M. and Bayat, Oguz and Ucan, Osman Nuri",2018,"[""ACM"",""Engineering Village""]","Proceedings of the First International Conference on Data Science, E-learning and Information Systems","10.1145/3279996.3280006"
"A Replication Study: Just-in-time Defect Prediction with Ensemble Learning","Young, Steven and Abdou, Tamer and Bener, Ayse",2018,"[""IEEE"",""ACM"",""Engineering Village""]","Proceedings of the 6th International Workshop on Realizing Artificial Intelligence Synergies in Software Engineering","10.1145/3194104.3194110"
"Synthesizing Object Transformation for Dynamic Software Updating","Gu, Tianxiao and Ma, Xiaoxing and Xu, Chang and Jiang, Yanyan and Cao, Chun and L\""{u}, Jian",2017,"[""IEEE"",""ACM""]","Proceedings of the 39th International Conference on Software Engineering Companion","10.1109/ICSE-C.2017.96"
"Storyteller: A New Medium for Guiding Students Through Code Examples (Abstract Only)","Mahoney, Mark",2018,"[""ACM""]","Proceedings of the 49th ACM Technical Symposium on Computer Science Education","10.1145/3159450.3162199"
"An Empirical Investigation of Changes in Some Software Properties over Time","Gil, Joseph and Goldstein, Maayan and Moshkovich, Dany",2012,"[""IEEE"",""ACM"",""Engineering Village""]","Proceedings of the 9th IEEE Working Conference on Mining Software Repositories",
"Automatic Generation of Release Notes","Moreno, Laura and Bavota, Gabriele and Di Penta, Massimiliano and Oliveto, Rocco and Marcus, Andrian and Canfora, Gerardo",2014,"[""ACM""]","Proceedings of the 22Nd ACM SIGSOFT International Symposium on Foundations of Software Engineering","10.1145/2635868.2635870"
"Visualizations of Evolving Graphical Models in the Context of Model Review","Zoubek, Florian and Langer, Philip and Mayerhofer, Tanja",2018,"[""ACM"",""Engineering Village""]","Proceedings of the 21th ACM/IEEE International Conference on Model Driven Engineering Languages and Systems","10.1145/3239372.3239403"
"An Ensemble SVM Model for the Accurate Prediction of Non-canonical MicroRNA Targets","Ghoshal, Asish and Grama, Ananth and Bagchi, Saurabh and Chaterji, Somali",2015,"[""ACM"",""Engineering Village""]","Proceedings of the 6th ACM Conference on Bioinformatics, Computational Biology and Health Informatics","10.1145/2808719.2808761"
"Advantages and Disadvantages of Using Shared Code from the Developers Perspective: A Qualitative Study","Ribeiro, Danilo Monteiro and da Silva, Fabio Q. B. and Valen\c{c}a, Diana and Freitas, Elyda L. S. X. and Fran\c{c}a, C{\'e}sar",2016,"[""ACM""]","Proceedings of the 10th ACM/IEEE International Symposium on Empirical Software Engineering and Measurement","10.1145/2961111.2962624"
"Rethinking Compilers in the Rise of Machine Learning and AI (Keynote)","Shen, Xipeng",2018,"[""ACM""]","Proceedings of the 27th International Conference on Compiler Construction","10.1145/3178372.3183634"
"Structural Health Monitoring by Using a Sparse Coding-based Deep Learning Algorithm with Wireless Sensor Networks","Guo, Junqi and Xie, Xiaobo and Bie, Rongfang and Sun, Limin",2014,"[""ACM""]",,"10.1007/s00779-014-0800-5"
"A Foundation for Refactoring C with Macros","Overbey, Jeffrey L. and Behrang, Farnaz and Hafiz, Munawar",2014,"[""ACM""]","Proceedings of the 22Nd ACM SIGSOFT International Symposium on Foundations of Software Engineering","10.1145/2635868.2635908"
"Characterizing the Roles of Classes and Their Fault-proneness Through Change Metrics","Steff, Maximilian and Russo, Barbara",2012,"[""IEEE"",""ACM"",""Engineering Village""]","Proceedings of the ACM-IEEE International Symposium on Empirical Software Engineering and Measurement","10.1145/2372251.2372261"
"Analysis of Hotspot Methods in JVM for Best-effort Run-time Parallelization","Ain, Qurrat Ul and Ahmed, Saqib and Zafar, Abdullah and Mehmood, Muhammad Amir and Waheed, Abdul",2018,"[""ACM""]","Proceedings of the 9th International Conference on E-Education, E-Business, E-Management and E-Learning","10.1145/3183586.3183607"
"Evaluator-executor Transformation for Efficient Pipelining of Loops with Conditionals","Jeong, Yeonghun and Seo, Seongseok and Lee, Jongeun",2013,"[""ACM""]",,"10.1145/2541228.2555317"
"Evaluator-executor Transformation for Efficient Pipelining of Loops with Conditionals","Jeong, Yeonghun and Seo, Seongseok and Lee, Jongeun",2013,"[""ACM""]",,"10.1145/2555289.2555317"
"How Confident Are You to Counter Uncertainty?","Sukarno, Parman and Bhattacharjee, Nandita and Srinivasan, Bala",2012,"[""ACM""]","Proceedings of the First International Conference on Security of Internet of Things","10.1145/2490428.2490445"
"Improving MiRNA Prediction Accuracy by Deep Learning Strategies","Xue, Bin",2015,"[""ACM""]","Proceedings of the 6th ACM Conference on Bioinformatics, Computational Biology and Health Informatics","10.1145/2808719.2811417"
"The Evolution of a Digital Ecosystem","Um, SungyYong",2015,"[""ACM""]","Companion to the Proceedings of the 11th International Symposium on Open Collaboration","10.1145/2789853.2789856"
"Predicting Defectiveness of Software Patches","Soltanifar, Behjat and Erdem, Atakan and Bener, Ayse",2016,"[""ACM"",""Engineering Village""]","Proceedings of the 10th ACM/IEEE International Symposium on Empirical Software Engineering and Measurement","10.1145/2961111.2962601"
"One-shot Learning Gesture Recognition from RGB-D Data Using Bag of Features","Wan, Jun and Ruan, Qiuqi and Li, Wei and Deng, Shuang",2013,"[""ACM""]",,
"Native-2-native: Automated Cross-platform Code Synthesis from Web-based Programming Resources","Byalik, Antuan and Chadha, Sanchit and Tilevich, Eli",2015,"[""ACM""]",,"10.1145/2936314.2814210"
"Native-2-native: Automated Cross-platform Code Synthesis from Web-based Programming Resources","Byalik, Antuan and Chadha, Sanchit and Tilevich, Eli",2015,"[""ACM""]","Proceedings of the 2015 ACM SIGPLAN International Conference on Generative Programming: Concepts and Experiences","10.1145/2814204.2814210"
"Speeding Up Iterative Polyhedral Schedule Optimization with Surrogate Performance Models","Ganser, Stefan and Gr\""{o}\sslinger, Armin and Siegmund, Norbert and Apel, Sven and Lengauer, Christian",2018,"[""ACM""]",,"10.1145/3291773"
"Rethinking User Interfaces for Feature Location","Beck, Fabian and Dit, Bogdan and Velasco-Madden, Jaleo and Weiskopf, Daniel and Poshyvanyk, Denys",2015,"[""ACM""]","Proceedings of the 2015 IEEE 23rd International Conference on Program Comprehension",
"A Methodology for Managing Database and Code Changes in a Regression Testing Framework","Salama, Roberto and McGuire, James and Rosenberg, Michael K.",2012,"[""ACM""]","Proceedings of the 3rd Annual Conference on Systems, Programming, and Applications: Software for Humanity","10.1145/2384716.2384766"
"Users Beware: Preference Inconsistencies Ahead","Behrang, Farnaz and Cohen, Myra B. and Orso, Alessandro",2015,"[""ACM"",""Engineering Village""]","Proceedings of the 2015 10th Joint Meeting on Foundations of Software Engineering","10.1145/2786805.2786869"
"An Automation Framework for Configuration Management to Reduce Manual Intervention","Karale, Supriya V. and Kaushal, Vishal",2016,"[""ACM"",""Engineering Village""]","Proceedings of the International Conference on Advances in Information Communication Technology \& Computing","10.1145/2979779.2979853"
"Small Code Changes Can Make Many Single-threaded CPU Programs Run Hundreds of Times Faster in Parallel on a GPU Using C++ AMP","Wynters, Erik L.",2018,"[""ACM""]",,
"On the Effectiveness of Random Testing for Android: Or How I Learned to Stop Worrying and Love the Monkey","Patel, Priyam and Srinivasan, Gokul and Rahaman, Sydur and Neamtiu, Iulian",2018,"[""ACM""]","Proceedings of the 13th International Workshop on Automation of Software Test","10.1145/3194733.3194742"
"Asynchronous Gaze Sharing: Towards a Dynamic Help System to Support Learners During Program Comprehension","Deitelhoff, Fabian",2018,"[""ACM""]","Proceedings of the 2018 ACM Symposium on Eye Tracking Research \& Applications","10.1145/3204493.3207421"
"Towards a Catalog of Variability Evolution Patterns: The Linux Kernel Case","Passos, Leonardo and Czarnecki, Krzysztof and W\k{a}sowski, Andrzej",2012,"[""ACM""]","Proceedings of the 4th International Workshop on Feature-Oriented Software Development","10.1145/2377816.2377825"
"Comprehension First: Evaluating a Novel Pedagogy and Tutoring System for Program Tracing in CS1","Nelson, Greg L. and Xie, Benjamin and Ko, Andrew J.",2017,"[""ACM""]","Proceedings of the 2017 ACM Conference on International Computing Education Research","10.1145/3105726.3106178"
"Needle: Detecting Code Plagiarism on Student Submissions","Jiang, Yanyan and Xu, Chang",2018,"[""ACM""]","Proceedings of ACM Turing Celebration Conference - China","10.1145/3210713.3210724"
"The Plastic Surgery Hypothesis","Barr, Earl T. and Brun, Yuriy and Devanbu, Premkumar and Harman, Mark and Sarro, Federica",2014,"[""ACM""]","Proceedings of the 22Nd ACM SIGSOFT International Symposium on Foundations of Software Engineering","10.1145/2635868.2635898"
"Adaptive Power Management in Solar Energy Harvesting Sensor Node Using Reinforcement Learning","Shresthamali, Shaswot and Kondo, Masaaki and Nakamura, Hiroshi",2017,"[""ACM""]",,"10.1145/3126495"
"Going Deeper Than Deep Learning for Massive Data Analytics Under Physical Constraints","Rouhani, Bita Darvish and Mirhoseini, Azalia and Koushanfar, Farinaz",2016,"[""ACM""]","Proceedings of the Eleventh IEEE/ACM/IFIP International Conference on Hardware/Software Codesign and System Synthesis","10.1145/2968456.2976766"
"Writing Reusable Code Feedback at Scale with Mixed-Initiative Program Synthesis","Head, Andrew and Glassman, Elena and Soares, Gustavo and Suzuki, Ryo and Figueredo, Lucas and D'Antoni, Loris and Hartmann, Bj\""{o}rn",2017,"[""ACM""]","Proceedings of the Fourth (2017) ACM Conference on Learning @ Scale","10.1145/3051457.3051467"
"Do Developers Update Third-party Libraries in Mobile Apps?","Salza, Pasquale and Palomba, Fabio and Di Nucci, Dario and D'Uva, Cosmo and De Lucia, Andrea and Ferrucci, Filomena",2018,"[""ACM"",""Engineering Village""]","Proceedings of the 26th Conference on Program Comprehension","10.1145/3196321.3196341"
"Unix Literacy for First-Year Computer Science Students","Kendon, Tyson and Stephenson, Ben",2016,"[""ACM""]","Proceedings of the 21st Western Canadian Conference on Computing Education","10.1145/2910925.2910930"
"A Reconfiguration Algorithm for Power-Aware Parallel Applications","De Sensi, Daniele and Torquati, Massimo and Danelutto, Marco",2016,"[""ACM""]",,"10.1145/3004054"
"Improving the Memory Access Locality of Hybrid MPI Applications","Diener, Matthias and White, Sam and Kale, Laxmikant V. and Campbell, Michael and Bodony, Daniel J. and Freund, Jonathan B.",2017,"[""ACM""]","Proceedings of the 24th European MPI Users' Group Meeting","10.1145/3127024.3127038"
"Using POGIL to Teach Students to Be Better Problem Solvers (Abstract Only)","Hu, Helen H.",2012,"[""ACM""]","Proceedings of the 43rd ACM Technical Symposium on Computer Science Education","10.1145/2157136.2157395"
"Question Independent Grading Using Machine Learning: The Case of Computer Program Grading","Singh, Gursimran and Srikant, Shashank and Aggarwal, Varun",2016,"[""ACM""]","Proceedings of the 22Nd ACM SIGKDD International Conference on Knowledge Discovery and Data Mining","10.1145/2939672.2939696"
"Author Retrospective for Optimizing for Parallelism and Data Locality","McKinley, Kathryn S.",2014,"[""ACM""]","ACM International Conference on Supercomputing 25th Anniversary Volume","10.1145/2591635.2591646"
"Model-driven Test Case Design for Model-to-model Semantics Preservation","Gerking, Christopher and Ladleif, Jan and Sch\""{a}fer, Wilhelm",2015,"[""ACM""]","Proceedings of the 6th International Workshop on Automating Test Case Design, Selection and Evaluation","10.1145/2804322.2804323"
"Incremental Symbolic Execution for Automated Test Suite Maintenance","Makhdoom, Sarmad and Khan, Muhammad Adeel and Siddiqui, Junaid Haroon",2014,"[""ACM""]","Proceedings of the 29th ACM/IEEE International Conference on Automated Software Engineering","10.1145/2642937.2642961"
"Cyber Education: Towards a Pedagogical and Heuristic Learning","Alvarez, Isabel Borges and Silva, Nuno S. Alves and Correia, Luisa Sampaio",2016,"[""ACM""]",,"10.1145/2874239.2874266"
"Implicit Theories of Programming Aptitude As a Barrier to Learning to Code: Are They Distinct from Intelligence?","Scott, Michael James and Ghinea, Gheorghita",2013,"[""ACM"",""Engineering Village""]","Proceedings of the 18th ACM Conference on Innovation and Technology in Computer Science Education","10.1145/2462476.2462515"
"Mining Control Flow Graph As API Call-grams to Detect Portable Executable Malware","Faruki, Parvez and Laxmi, Vijay and Gaur, M. S. and Vinod, P.",2012,"[""ACM""]","Proceedings of the Fifth International Conference on Security of Information and Networks","10.1145/2388576.2388594"
"Exploring the Impact of Inter-smell Relations on Software Maintainability: An Empirical Study","Yamashita, Aiko and Moonen, Leon",2013,"[""ACM""]","Proceedings of the 2013 International Conference on Software Engineering",
"Code Parallelization Through Sequential Code Search","Cai, Bowen",2016,"[""ACM""]","Proceedings of the 38th International Conference on Software Engineering Companion","10.1145/2889160.2891045"
"vsInk: Integrating Digital Ink with Program Code in Visual Studio","Sutherland, Craig J. and Plimmer, Beryl",2013,"[""ACM""]","Proceedings of the Fourteenth Australasian User Interface Conference - Volume 139",
"Speeding Up Database Applications with Pyxis","Cheung, Alvin and Arden, Owen and Madden, Samuel and Myers, Andrew C.",2013,"[""ACM""]","Proceedings of the 2013 ACM SIGMOD International Conference on Management of Data","10.1145/2463676.2465265"
"Acquiring Human-Robot Interaction Skills with Transfer Learning Techniques","Mohammed, Omar and Bailly, Gerard and Pellier, Damien",2017,"[""ACM""]","Proceedings of the Companion of the 2017 ACM/IEEE International Conference on Human-Robot Interaction","10.1145/3029798.3034823"
"Transforming US Education with Computer Science","Partovi, Hadi",2014,"[""ACM""]","Proceedings of the 45th ACM Technical Symposium on Computer Science Education","10.1145/2538862.2554793"
"Assessing the Value of Branches with What-if Analysis","Bird, Christian and Zimmermann, Thomas",2012,"[""ACM""]","Proceedings of the ACM SIGSOFT 20th International Symposium on the Foundations of Software Engineering","10.1145/2393596.2393648"
"Trading Robustness for Maintainability: An Empirical Study of Evolving C\# Programs","Cacho, N{\'e}lio and C{\'e}sar, Thiago and Filipe, Thomas and Soares, Eliezio and Cassio, Arthur and Souza, Rafael and Garcia, Israel and Barbosa, Eiji Adachi and Garcia, Alessandro",2014,"[""ACM""]","Proceedings of the 36th International Conference on Software Engineering","10.1145/2568225.2568308"
"SINk: A Middleware for Synchronization of Heterogeneous Software Interfaces","Hosseini, Mohammad and Jiang, Yu and Wu, Poliang and Berlin,Jr., Richard B. and Sha, Lui",2015,"[""ACM""]","Proceedings of the 14th International Workshop on Adaptive and Reflective Middleware","10.1145/2834965.2834967"
"LDA Revisited: Entropy, Prior and Convergence","Zhang, Jianwei and Zeng, Jia and Yuan, Mingxuan and Rao, Weixiong and Yan, Jianfeng",2016,"[""ACM""]","Proceedings of the 25th ACM International on Conference on Information and Knowledge Management","10.1145/2983323.2983794"
"LEGO-based Active Learning Exercises for Teaching Software Development: (Abstract Only)","Kurkovsky, Stan and Ludi, Stephanie",2018,"[""ACM""]","Proceedings of the 49th ACM Technical Symposium on Computer Science Education","10.1145/3159450.3162357"
"DeFlaker: Automatically Detecting Flaky Tests","Bell, Jonathan and Legunsen, Owolabi and Hilton, Michael and Eloussi, Lamyaa and Yung, Tifany and Marinov, Darko",2018,"[""ACM""]","Proceedings of the 40th International Conference on Software Engineering","10.1145/3180155.3180164"
"Unravel: Rapid Web Application Reverse Engineering via Interaction Recording, Source Tracing, and Library Detection","Hibschman, Joshua and Zhang, Haoqi",2015,"[""ACM""]","Proceedings of the 28th Annual ACM Symposium on User Interface Software \&\#38; Technology","10.1145/2807442.2807468"
"Live Versioning of Web Applications Through Refactoring","Grigera, Juli\'{a}n and Gardey, Juan Cruz and Garrido, Alejandra and Rossi, Gustavo",2018,"[""ACM""]","Proceedings of the 33rd ACM/IEEE International Conference on Automated Software Engineering","10.1145/3238147.3240483"
"Selective Regression Testing for Web Applications Created with Google Web Toolkit","Hirzel, Matthias",2014,"[""ACM""]","Proceedings of the 2014 International Conference on Principles and Practices of Programming on the Java Platform: Virtual Machines, Languages, and Tools","10.1145/2647508.2647527"
