"name","authors","year","base","booktitle","doi"
"Validation of the MCU-PTR computational model of beryllium poisoning using selected experiments at the IRT-T research reactor","M.V. Shchurovskaya and V.P. Alferov and N.I. Geraskin and A.I. Radaev and A.G. Naymushin and Yu.B. Chertkov and M.N. Anikin and I.I. Lebedev",2018,"[""Science Direct""]",,"https://doi.org/10.1016/j.anucene.2017.11.046"
"Mitochondrial genotype modulates mtDNA copy number and organismal phenotype in Drosophila","Tiina S. Salminen and Marcos T. Oliveira and Giuseppe Cannino and Päivi Lillsunde and Howard T. Jacobs and Laurie S. Kaguni",2017,"[""Science Direct""]",,"https://doi.org/10.1016/j.mito.2017.02.001"
"The hazard prediction test: A comparison of free-response and multiple-choice formats","Petya Ventsislavova and David Crundall",2018,"[""Science Direct""]",,"https://doi.org/10.1016/j.ssci.2018.06.004"
"F-TRIDYN: A Binary Collision Approximation code for simulating ion interactions with rough surfaces","Jon Drobny and Alyssa Hayes and Davide Curreli and David N. Ruzic",2017,"[""Science Direct"",""Engineering Village""]",,"https://doi.org/10.1016/j.jnucmat.2017.07.037"
"Solution of the Skyrme–HF+BCS equation on a 3D mesh, II: A new version of the Ev8 code","W. Ryssens and V. Hellemans and M. Bender and P.-H. Heenen",2015,"[""Science Direct""]",,"https://doi.org/10.1016/j.cpc.2014.10.001"
"Simulation of boil-off losses during transfer at a LH2 based hydrogen refueling station","Guillaume Petitpas",2018,"[""Science Direct""]",,"https://doi.org/10.1016/j.ijhydene.2018.09.132"
"Information transmission and the oral tradition: Evidence of a late-life service niche for Tsimane Amerindians","Eric Schniter and Nathaniel T. Wilcox and Bret A. Beheim and Hillard S. Kaplan and Michael Gurven",2018,"[""Science Direct""]",,"https://doi.org/10.1016/j.evolhumbehav.2017.10.006"
"Visualizing Time-based Weighted Coupling Using Particle Swarm Optimization to Aid Program Comprehension","Rully Agus Hendrawan and Katsuhisa Maruyama",2015,"[""Science Direct"",""Engineering Village""]",,"https://doi.org/10.1016/j.procs.2015.12.168"
"Food Insecurity Experience: Building Empathy in Future Food and Nutrition Professionals","Alison Harmon and Kara Landolfi and Carmen Byker Shanks and Leanna Hansen and Laura Iverson and Melody Anacker",2017,"[""Science Direct""]",,"https://doi.org/10.1016/j.jneb.2016.10.023"
"A coupled approach for vehicle brake cooling performance simulations","Alexey Vdovin and Mats Gustafsson and Simone Sebben",2018,"[""Science Direct""]",,"https://doi.org/10.1016/j.ijthermalsci.2018.05.016"
"Energy use implications of different design strategies for multi-storey residential buildings under future climates","Uniben Yao Ayikoe Tettey and Ambrose Dodoo and Leif Gustavsson",2017,"[""Science Direct"",""Engineering Village""]",,"https://doi.org/10.1016/j.energy.2017.07.123"
"Centrality bias measure for high density QR code module recognition","Iuliia Tkachenko and William Puech and Olivier Strauss and Jean-Marc Gaudin and Christophe Destruel and Christian Guichard",2016,"[""Science Direct""]",,"https://doi.org/10.1016/j.image.2015.11.007"
"Electronic stopping in oxides beyond Bragg additivity","P. Sigmund and A. Schinner",2018,"[""Science Direct""]",,"https://doi.org/10.1016/j.nimb.2017.11.023"
"Mapping Abbreviated Injury Scale data from 1990 to 1998 versions: A stepping-stone in the contemporary evaluation of trauma","Cameron S. Palmer and Jacelle Lang and Glen Russell and Natalie Dallow and Kathy Harvey and Belinda Gabbe and Peter Cameron",2013,"[""Science Direct""]",,"https://doi.org/10.1016/j.injury.2012.08.033"
"Investigation on the potential use of thorium as fuel for the Sodium-cooled Fast Reactor","H. György and Sz. Czifrus",2017,"[""Science Direct""]",,"https://doi.org/10.1016/j.anucene.2017.01.030"
"Exploring the relations between epistemic beliefs, emotions, and learning from texts","Gregory J. Trevors and Krista R. Muis and Reinhard Pekrun and Gale M. Sinatra and Marloes M.L. Muijselaar",2017,"[""Science Direct""]",,"https://doi.org/10.1016/j.cedpsych.2016.10.001"
"Adaptively post-encoding multiple description video coding","Xuguang Lan and Meng Yang and Yuan Yuan and Songlin Zhao and Nanning Zheng",2013,"[""Science Direct""]",,"https://doi.org/10.1016/j.neucom.2012.08.015"
"Face recognition algorithm based on discriminative dictionary learning and sparse representation","Zhenyu Lu and  Linghua Zhang",2016,"[""Science Direct""]",,"https://doi.org/10.1016/j.neucom.2015.09.091"
"Associative Fear Learning Enhances Sparse Network Coding in Primary Sensory Cortex","Amos Gdalyahu and Elaine Tring and Pierre-Olivier Polack and Robin Gruver and Peyman Golshani and Michael S. Fanselow and Alcino J. Silva and Joshua T. Trachtenberg",2012,"[""Science Direct""]",,"https://doi.org/10.1016/j.neuron.2012.04.035"
"Shifting attitudes towards research and evidence-based medicine within the naturopathic medical community: The power of people, money and acceptance","Joshua Z. Goldenberg and Bonnie S. Burlingham and Jane Guiltinan and Erica B. Oberg",2017,"[""Science Direct""]",,"https://doi.org/10.1016/j.aimed.2017.08.003"
"Transformation of Arden Syntax's medical logic modules into ArdenML for a business rules management system","Chai Young Jung and Jong-Ye Choi and Seong Jik Jeong and Kyunghee Cho and Yong Duk Koo and Jin Hee Bae and Sukil Kim",2018,"[""Science Direct""]",,"https://doi.org/10.1016/j.artmed.2016.03.005"
"JaSTA-2: Second version of the Java Superposition T-matrix Application","Prithish Halder and Himadri Sekhar Das",2017,"[""Science Direct""]",,"https://doi.org/10.1016/j.cpc.2017.08.020"
"Learning to know, be, do, and live together with in the cross-cultural experiences of immigrant teacher educators","Patriann Smith",2018,"[""Science Direct""]",,"https://doi.org/10.1016/j.tate.2017.10.018"
"Learning-based approach for layered adaptive video streaming over SDN","Tuba Uzakgider and Cihat Cetinkaya and Muge Sayit",2015,"[""Science Direct""]",,"https://doi.org/10.1016/j.comnet.2015.09.027"
"MC21 v.6.0 – A continuous-energy Monte Carlo particle transport code with integrated reactor feedback capabilities","D.P. Griesheimer and D.F. Gill and B.R. Nease and T.M. Sutton and M.H. Stedry and P.S. Dobreff and D.C. Carpenter and T.H. Trumbull and E. Caro and H. Joo and D.L. Millman",2015,"[""Science Direct""]",,"https://doi.org/10.1016/j.anucene.2014.08.020"
"A linear approach for sparse coding by a two-layer neural network","Alessandro Montalto and Giovanni Tessitore and Roberto Prevete",2015,"[""Science Direct"",""Engineering Village""]",,"https://doi.org/10.1016/j.neucom.2014.08.066"
"Full 1-loop calculation of BR(Bs,d0→ℓℓ̄) in models beyond the MSSM with SARAH  and SPheno","H. Dreiner and K. Nickel and W. Porod and F. Staub",2013,"[""Science Direct""]",,"https://doi.org/10.1016/j.cpc.2013.06.021"
"Generative software product line development using variability-aware design patterns","Christoph Seidl and Sven Schuster and Ina Schaefer",2017,"[""Science Direct""]",,"https://doi.org/10.1016/j.cl.2016.08.006"
"Dynamic changes of resting state connectivity related to the acquisition of a lexico-semantic skill","L. Schlaffke and L. Schweizer and N.N. Rüther and R. Luerding and M. Tegenthoff and C. Bellebaum and T. Schmidt-Wilcke",2017,"[""Science Direct""]",,"https://doi.org/10.1016/j.neuroimage.2016.08.065"
"A brief history of parameterized matching problems","Juan Mendivelso and Sharma V. Thankachan and Yoan Pinzón",2018,"[""Science Direct"",""Engineering Village""]",,"https://doi.org/10.1016/j.dam.2018.07.017"
"Metaphors of code—Structuring and broadening the discussion on teaching children to code","Tomi Dufva and Mikko Dufva",2016,"[""Science Direct""]",,"https://doi.org/10.1016/j.tsc.2016.09.004"
"Non-accidental properties, metric invariance, and encoding by neurons in a model of ventral stream visual object recognition, VisNet","Edmund T. Rolls and W. Patrick C. Mills",2018,"[""Science Direct""]",,"https://doi.org/10.1016/j.nlm.2018.04.017"
"Assessment of ASSERT-PV for prediction of critical heat flux in CANDU bundles","Y.F. Rao and Z. Cheng and G.M. Waddington",2014,"[""Science Direct"",""Engineering Village""]",,"https://doi.org/10.1016/j.nucengdes.2014.06.004"
"Letters don’t matter: No effect of orthography on the perception of conversational speech","Holger Mitterer and Eva Reinisch",2015,"[""Science Direct""]",,"https://doi.org/10.1016/j.jml.2015.08.005"
"Study of the influence of atmospheric air climatic parameters on the air kerma measurements in low energy X reference radiation fields","M.T.T. Figueiredo and M.A.S. Lacerda and T.A. da Silva",2019,"[""Science Direct""]",,"https://doi.org/10.1016/j.radphyschem.2018.08.031"
"Automatic parallelization of recursive functions with rewriting rules","Rodrigo C.O. Rocha and Luís F.W. Góes and Fernando M.Q. Pereira",2018,"[""Science Direct"",""Engineering Village""]",,"https://doi.org/10.1016/j.scico.2018.01.004"
"Student Reflection Papers on a Global Clinical Experience: A Qualitative Study","Carmi Z. Margolis and Robert M. Rohrbaugh and Luisa Tsang and Jennifer Fleischer and Mark J. Graham and Anne Kellett and Janet P. Hafler",2017,"[""Science Direct""]",,"https://doi.org/10.1016/j.aogh.2017.04.006"
"Thermal hydraulic model of the molten salt reactor experiment with the NEAMS system analysis module","Adrian M. Leandro and Florent Heidet and Rui Hu and Nicholas R. Brown",2019,"[""Science Direct"",""Engineering Village""]",,"https://doi.org/10.1016/j.anucene.2018.10.060"
"DFMDEF18: A C-code for the double folding interaction potential of a spherical nucleus with deformed nucleus","I.I. Gontchar and M.V. Chushnyakova",2018,"[""Science Direct""]",,"https://doi.org/10.1016/j.cpc.2017.09.008"
"PFMCal : Photonic force microscopy calibration extended for its application in high-frequency microrheology","A. Butykai and P. Domínguez-García and F.M. Mor and R. Gaál and L. Forró and S. Jeney",2017,"[""Science Direct""]",,"https://doi.org/10.1016/j.cpc.2017.07.019"
"A Comparison of Natural Language Processing Methods for Automated Coding of Motivational Interviewing","Michael Tanana and Kevin A. Hallgren and Zac E. Imel and David C. Atkins and Vivek Srikumar",2016,"[""Science Direct""]",,"https://doi.org/10.1016/j.jsat.2016.01.006"
"How can a recurrent neurodynamic predictive coding model cope with fluctuation in temporal patterns? Robotic experiments on imitative interaction","Ahmadreza Ahmadi and Jun Tani",2017,"[""Science Direct""]",,"https://doi.org/10.1016/j.neunet.2017.02.015"
"Experimental fatigue crack growth behavior and predictions under multiaxial variable amplitude service loading histories","Nicholas R. Gates and Ali Fatemi",2017,"[""Science Direct""]",,"https://doi.org/10.1016/j.engfracmech.2016.11.023"
"GenASiS   Basics: Object-oriented utilitarian functionality for large-scale physics simulations (Version 2)","Christian Y. Cardall and Reuben D. Budiardja",2017,"[""Science Direct""]",,"https://doi.org/10.1016/j.cpc.2016.12.019"
"Assessment of ASSERT-PV for prediction of post-dryout heat transfer in CANDU bundles","Z. Cheng and Y.F. Rao and G.M. Waddington",2014,"[""Science Direct"",""Engineering Village""]",,"https://doi.org/10.1016/j.nucengdes.2014.07.031"
"HOTB: High precision parallel code for calculation of four-particle harmonic oscillator transformation brackets","A. Stepšys and S. Mickevicius and D. Germanas and R.K. Kalinauskas",2014,"[""Science Direct"",""Engineering Village""]",,"https://doi.org/10.1016/j.cpc.2014.06.025"
"Developmental metaplasticity in neural circuit codes of firing and structure","Yoram Baram",2017,"[""Science Direct""]",,"https://doi.org/10.1016/j.neunet.2016.09.007"
"A method to localize faults in concurrent C programs","Erickson H. da S. Alves and Lucas C. Cordeiro and Eddie B. de L. Filho",2017,"[""Science Direct"",""Engineering Village""]",,"https://doi.org/10.1016/j.jss.2017.03.010"
"Dr TIM: Ray-tracer TIM, with additional specialist scientific capabilities","Stephen Oxburgh and Tomáš Tyc and Johannes Courtial",2014,"[""Science Direct""]",,"https://doi.org/10.1016/j.cpc.2013.10.031"
"Inquiry into sustainability issues by preservice teachers: A pedagogy to enhance sustainability consciousness","Qudsia Kalsoom and Afifa Khanam",2017,"[""Science Direct""]",,"https://doi.org/10.1016/j.jclepro.2017.07.047"
"The Role of Education, Educational Processes, and Education Culture on the Development of Virtual Learning in Iran","Mojdeh Naderzadeh Gavareshki and F. Haddadian and Mc. HassanzadehKalleh",2012,"[""Science Direct""]",,"https://doi.org/10.1016/j.sbspro.2012.06.442"
"A novel algorithm for longitudinal track-bridge interactions considering loading history and using a verified mechanical model of fasteners","Jun Luo and Zhiping Zeng",2019,"[""Science Direct""]",,"https://doi.org/10.1016/j.engstruct.2019.01.001"
"A binary differential evolution algorithm learning from explored solutions","Yu Chen and Weicheng Xie and Xiufen Zou",2015,"[""Science Direct""]",,"https://doi.org/10.1016/j.neucom.2014.07.030"
"MT: A Mathematica package to compute convolutions","Maik Höschele and Jens Hoff and Alexey Pak and Matthias Steinhauser and Takahiro Ueda",2014,"[""Science Direct""]",,"https://doi.org/10.1016/j.cpc.2013.10.007"
"The relationship between counselors' technical skills, clients' in-session verbal responses, and outcome in smoking cessation treatment","Helena Lindqvist and Lars Forsberg and Pia Enebrink and Gerhard Andersson and Ingvar Rosendahl",2017,"[""Science Direct""]",,"https://doi.org/10.1016/j.jsat.2017.02.004"
"Machine Learning Methods to Extract Documentation of Breast Cancer Symptoms From Electronic Health Records","Alexander W. Forsyth and Regina Barzilay and Kevin S. Hughes and Dickson Lui and Karl A. Lorenz and Andrea Enzinger and James A. Tulsky and Charlotta Lindvall",2018,"[""Science Direct""]",,"https://doi.org/10.1016/j.jpainsymman.2018.02.016"
"Implementation of an efficient logarithmic-Hamiltonian three-body code","Seppo Mikkola and Kiyotaka Tanikawa",2013,"[""Science Direct""]",,"https://doi.org/10.1016/j.newast.2012.09.004"
"Non-linearity issues and multiple ionization satellites in the PIXE portion of spectra from the Mars alpha particle X-ray spectrometer","John L. Campbell and Christopher M. Heirwegh and Brianna Ganly",2016,"[""Science Direct""]",,"https://doi.org/10.1016/j.nimb.2016.07.004"
"An empirical evaluation of supervised learning approaches in assigning diagnosis codes to electronic medical records","Ramakanth Kavuluru and Anthony Rios and Yuan Lu",2015,"[""Science Direct"",""Engineering Village""]",,"https://doi.org/10.1016/j.artmed.2015.04.007"
"History and genomic sequence analysis of the herpes simplex virus 1 KOS and KOS1.1 sub-strains","Robert C. Colgrove and Xueqiao Liu and Anthony Griffiths and Priya Raja and Neal A. Deluca and Ruchi M. Newman and Donald M. Coen and David M. Knipe",2016,"[""Science Direct""]",,"https://doi.org/10.1016/j.virol.2015.09.026"
"F-TRIDYN simulations of tungsten self-sputtering and applications to coupling plasma and material codes","Jon Drobny and Davide Curreli",2018,"[""Science Direct""]",,"https://doi.org/10.1016/j.commatsci.2018.03.032"
"Spatial imagery of novel places based on visual scene transformation","Naoyuki Sato",2012,"[""Science Direct""]",,"https://doi.org/10.1016/j.cogsys.2010.12.010"
"mRPL: Boosting mobility in the Internet of Things","Hossein Fotouhi and Daniel Moreira and Mário Alves",2015,"[""Science Direct""]",,"https://doi.org/10.1016/j.adhoc.2014.10.009"
"PSCAD modeling of a two-level space vector pulse width modulation algorithm for power electronics education","Ahmet Mete Vural",2016,"[""Science Direct""]",,"https://doi.org/10.1016/j.jesit.2016.01.005"
"Semi-supervised manifold-embedded hashing with joint feature representation and classifier learning","Tiecheng Song and Jianfei Cai and Tianqi Zhang and Chenqiang Gao and Fanman Meng and Qingbo Wu",2017,"[""Science Direct""]",,"https://doi.org/10.1016/j.patcog.2017.03.004"
"Impact of introduction of the 9-valent human papillomavirus vaccine on vaccination coverage of youth in North Carolina","Justin G. Trogdon and Paul Shafer and Brianna Lindsay and Tamera Coyne-Beasley",2018,"[""Science Direct""]",,"https://doi.org/10.1016/j.vaccine.2018.01.013"
"Evaluation and utilization of CloudSat and CALIPSO data to analyze the impact of dust aerosol on the microphysical properties of cirrus over the Tibetan Plateau","Baiwan Pan and Zhendong Yao and Minzhong Wang and Honglin Pan and Lingbing Bu and K. Raghavendra Kumar and Haiyang Gao and Xingyou Huang",2019,"[""Science Direct""]",,"https://doi.org/10.1016/j.asr.2018.07.004"
"On a pursuit for perfecting an undergraduate requirements engineering course","Chandan R. Rupakheti and Mark Hays and Sriram Mohan and Stephen Chenoweth and Amanda Stouder",2018,"[""Science Direct""]",,"https://doi.org/10.1016/j.jss.2018.07.008"
"Real Time Strategy Games: A Reinforcement Learning Approach","Harshit Sethy and Amit Patel and Vineet Padmanabhan",2015,"[""Science Direct""]",,"https://doi.org/10.1016/j.procs.2015.06.030"
"ASSERT-PV 3.2: Advanced subchannel thermalhydraulics code for CANDU fuel bundles","Y.F. Rao and Z. Cheng and G.M. Waddington and A. Nava-Dominguez",2014,"[""Science Direct""]",,"https://doi.org/10.1016/j.nucengdes.2014.04.016"
"Continuous validation of ASTEC containment models and regression testing","Holger Nowack and Nils Reinke and Martin Sonnenkalb",2014,"[""Science Direct""]",,"https://doi.org/10.1016/j.nucengdes.2013.06.038"
"Pulsed laser annealing of carbon black","Joseph P. Abrahamson and Madhu Singh and Jonathan P. Mathews and Randy L. Vander Wal",2017,"[""Science Direct""]",,"https://doi.org/10.1016/j.carbon.2017.08.080"
"Performance of Direct Displacement Based Design on Regular Concrete Building Against Indonesian Response Spectrum","Ima Muljati and Benjamin Lumantarna and Reynaldo P. Intan and Arygianny Valentino",2017,"[""Science Direct"",""Engineering Village""]",,"https://doi.org/10.1016/j.proeng.2017.01.438"
"Quality improvement of International Classification of Diseases, 9th revision, diagnosis coding in radiation oncology: Single-institution prospective study at University of California, San Francisco","Chien P. Chen and Steve Braunstein and Michelle Mourad and I-Chow J. Hsu and Daphne Haas-Kogan and Mack Roach and Shannon E. Fogh",2015,"[""Science Direct""]",,"https://doi.org/10.1016/j.prro.2014.03.007"
"A perturbation-based susbtep method for coupled depletion Monte-Carlo codes","Dan Kotlyar and Manuele Aufiero and Eugene Shwageraus and Massimiliano Fratoni",2017,"[""Science Direct"",""Engineering Village""]",,"https://doi.org/10.1016/j.anucene.2016.12.022"
"Joint palaeoclimate reconstruction from pollen data via forward models and climate histories","Andrew C. Parnell and John Haslett and James Sweeney and Thinh K. Doan and Judy R.M. Allen and Brian Huntley",2016,"[""Science Direct"",""Engineering Village""]",,"https://doi.org/10.1016/j.quascirev.2016.09.007"
"Development of an integrated fission product release and transport code for spatially resolved full-core calculations of V/HTRs","Andre Xhonneux and Hans-Josef Allelein",2014,"[""Science Direct"",""Engineering Village""]",,"https://doi.org/10.1016/j.nucengdes.2013.11.063"
"Revised calculation of four-particle harmonic-oscillator transformation brackets matrix","S. Mickevičius and D. Germanas and R.K. Kalinauskas",2013,"[""Science Direct"",""Engineering Village""]",,"https://doi.org/10.1016/j.cpc.2012.09.021"
"Extension and application of the reactor dynamics code DYN3D for Block-type High Temperature Reactors","Silvio Baier and Emil Fridman and Soeren Kliem and Ulrich Rohde",2014,"[""Science Direct"",""Engineering Village""]",,"https://doi.org/10.1016/j.nucengdes.2013.12.013"
"Learning-Induced Plasticity in Medial Prefrontal Cortex Predicts Preference Malleability","Mona M. Garvert and Michael Moutoussis and Zeb Kurth-Nelson and Timothy E.J. Behrens and Raymond J. Dolan",2015,"[""Science Direct""]",,"https://doi.org/10.1016/j.neuron.2014.12.033"
"Change in 1-year hospitalization of overall and older patients with major depressive disorder after second-generation antipsychotics augmentation treatment","Chun-Yuan Lin and Te-Jen Lai and Yu-Hsin Wu and Ping-Kun Chen and Yuan-Fu Lin and I.-Chia Chien",2018,"[""Science Direct""]",,"https://doi.org/10.1016/j.jad.2018.01.011"
"Time as context: The influence of hierarchical patterning on sensory inference","Juanita Todd and Anne Petherbridge and Bronte Speirs and Alexander Provost and Bryan Paton",2018,"[""Science Direct""]",,"https://doi.org/10.1016/j.schres.2017.03.033"
"Property size drives differences in forest code compliance in the Brazilian Cerrado","Mauricio Stefanes and Fabio de Oliveira Roque and Reinaldo Lourival and Isabel Melo and Pierre Cyril Renaud and Jose Manuel Ochoa Quintero",2018,"[""Science Direct""]",,"https://doi.org/10.1016/j.landusepol.2018.03.022"
"A numerical methodology for estimation of volatile fission products release from nuclear fuel","Mahender Singh and Deb Mukhopadhyay and D. Datta",2017,"[""Science Direct""]",,"https://doi.org/10.1016/j.nucengdes.2017.02.036"
"An Innovative Self-learning Approach to 3D Printing Using Multimedia and Augmented Reality on Mobile Devices","Vianney Lara-Prieto and Efraín Bravo-Quirino and Miguel Ángel Rivera-Campa and José Enrique Gutiérrez-Arredondo",2015,"[""Science Direct""]",,"https://doi.org/10.1016/j.procs.2015.12.206"
"Exogenously-driven perceptual alternation of a bistable image: From the perspective of the visual change detection process","Tomokazu Urakawa and Tomoya Aragaki and Osamu Araki",2017,"[""Science Direct""]",,"https://doi.org/10.1016/j.neulet.2017.05.041"
"Modification and application of the system analysis code ATHLET to trans-critical simulations","S.W. Fu and X.J. Liu and C. Zhou and Z.H. Xu and Y.H. Yang and X. Cheng",2012,"[""Science Direct"",""Engineering Village""]",,"https://doi.org/10.1016/j.anucene.2012.02.005"
"Advances in integrative statistics for logic programming","Nicos Angelopoulos and Samer Abdallah and Georgios Giamas",2016,"[""Science Direct""]",,"https://doi.org/10.1016/j.ijar.2016.06.008"
"Tensor Discriminant Analysis with Partial Label","Kai Huang and Di Zhou and Yingna Cong and Wen Xu and Wei Wang and Zhiguo Que",2018,"[""Science Direct""]",,"https://doi.org/10.1016/j.procs.2018.04.225"
"Trunk–pelvis coordination during turning: A cross sectional study of young adults with and without a history of low back pain","Jo Armour Smith and Kornelia Kulig",2016,"[""Science Direct""]",,"https://doi.org/10.1016/j.clinbiomech.2016.05.011"
"Decoding the processing stages of mental arithmetic with magnetoencephalography","Pedro Pinheiro-Chagas and Manuela Piazza and Stanislas Dehaene",2018,"[""Science Direct""]",,"https://doi.org/10.1016/j.cortex.2018.07.018"
"Analysis of the effect of climate change on the reliability of overhead transmission lines","Seyedeh Nasim Rezaei and Luc Chouinard and Sébastien Langlois and Frédéric Légeron",2016,"[""Science Direct""]",,"https://doi.org/10.1016/j.scs.2016.01.007"
"Effects of variable sequences of food availability on interval time-place learning by pigeons","Daniel García-Gallardo and Claudio Carpio",2016,"[""Science Direct""]",,"https://doi.org/10.1016/j.beproc.2016.07.008"
"Relations between specific and global outcome measures in a social-communication intervention for children with autism spectrum disorder","Anders Nordahl-Hansen and Sue Fletcher-Watson and Helen McConachie and Anett Kaale",2016,"[""Science Direct""]",,"https://doi.org/10.1016/j.rasd.2016.05.005"
"How Java APIs break – An empirical study","Kamil Jezek and Jens Dietrich and Premek Brada",2015,"[""Science Direct""]",,"https://doi.org/10.1016/j.infsof.2015.02.014"
"Random neural network based cognitive engines for adaptive modulation and coding in LTE downlink systems","Ahsan Adeel and Hadi Larijani and Ali Ahmadinia",2017,"[""Science Direct""]",,"https://doi.org/10.1016/j.compeleceng.2016.11.005"
"Designing Adult Code Simulations for Antepartum and Postpartum Nurses","Judy P. Brown and Claire Zaya",2013,"[""Science Direct""]",,"https://doi.org/10.1111/1552-6909.12056"
"Effects of physics change in Monte Carlo code on electron pencil beam dose distributions","Abdelkader Toutaoui and Nadia Khelassi-Toutaoui and Zakia Brahimi and Ahmed Chafik Chami",2012,"[""Science Direct"",""Engineering Village""]",,"https://doi.org/10.1016/j.radphyschem.2011.08.009"
"NDL-v2.0: A new version of the numerical differentiation library for parallel architectures","P.E. Hadjidoukas and P. Angelikopoulos and C. Voglis and D.G. Papageorgiou and I.E. Lagaris",2014,"[""Science Direct""]",,"https://doi.org/10.1016/j.cpc.2014.04.002"
"Incorporating 3-dimensional models in online articles","Lucia H.S. Cevidanes and Antonio C.O. Ruellas and Julien Jomier and Tung Nguyen and Steve Pieper and Francois Budin and Martin Styner and Beatriz Paniagua",2015,"[""Science Direct""]",,"https://doi.org/10.1016/j.ajodo.2015.02.002"
"Mitochondrial phylogeny, divergence history and high-altitude adaptation of grassland caterpillars (Lepidoptera: Lymantriinae: Gynaephora) inhabiting the Tibetan Plateau","Ming-Long Yuan and Qi-Lin Zhang and Li Zhang and Cheng-Lin Jia and Xiao-Peng Li and Xing-Zhuo Yang and Run-Qiu Feng",2018,"[""Science Direct""]",,"https://doi.org/10.1016/j.ympev.2018.01.016"
"Improving Orthopedic Resident Knowledge of Documentation, Coding, and Medicare Fraud","Matthew A. Varacallo and Michael Wolf and Martin J. Herman",2017,"[""Science Direct""]",,"https://doi.org/10.1016/j.jsurg.2017.02.003"
"Resilient Dynamic Data Driven Application Systems (rDDDAS)","Glynis Dsouza and Salim Hariri and Youssif Al-Nashif and Gabriel Rodriguez",2013,"[""Science Direct""]",,"https://doi.org/10.1016/j.procs.2013.05.362"
